{
  "crosswalk_id": "CONSTITUTIONAL-BECOMING-SPINE-ESTATE-CROSSWALK-F0.1",
  "version": "F0.1",
  "standing": "FROZEN_ESTATE_RECONCILIATION",
  "runtime_effect": "NONE",
  "authority_effect": "NONE",
  "canon_effect": "NONE",
  "freeze_scope": {
    "frozen": [
      "The thirteen burden names and their human-facing display order.",
      "The rule that the display order is a coarse conformance view over a typed causal hypergraph, not a claim of thirteen atomic runtime states.",
      "The requirement that each mapped carrier retain its own type, standing, identity, cardinality, and non-conversions.",
      "The eight-surface BecomingView projection defined in this crosswalk.",
      "The promotion-and-collapse conservation pair, with its genealogy preserved."
    ],
    "not_frozen": [
      "A universal synchronous implementation order.",
      "A monolithic service or new organ.",
      "A claim that every existing profile implements all thirteen burdens in one route.",
      "The unresolved front-edge adapter, cross-package return adapter, or colliding type names.",
      "Production, canon, external-effect, or mathematical-proof standing."
    ]
  },
  "topology": {
    "kind": "TYPED_CAUSAL_HYPERGRAPH",
    "display_order": [
      "CBS-01",
      "CBS-02",
      "CBS-03",
      "CBS-04",
      "CBS-05",
      "CBS-06",
      "CBS-07",
      "CBS-08",
      "CBS-09",
      "CBS-10",
      "CBS-11",
      "CBS-12",
      "CBS-13"
    ],
    "linearity_claim": false,
    "cardinality_rules": [
      "ONE-RCC F0.1 binds one AttemptAdmission to one exact authorized attempt identity.",
      "TOP F0.1 separately permits one AttemptAdmission to govern zero or many ExecutionAttempt records; this is a profile collision, not an equivalence.",
      "TOP permits one attempt to yield zero or many occurrences, one occurrence to yield zero or many observations, and one observation to yield zero or many receipts.",
      "Inheritance is optional and occurs only after an independently based admitting disposition."
    ],
    "joins": [
      "ONE-RCC branches an occurrence into a semantic receipt/candidate path and an observation/evidence/runtime-receipt path; both meet at the RuntimeCandidateGate.",
      "ONE V1 joins Proof Return, SourcePoint Fit Return, and SourcePoint disposition before any InheritanceRecord or successor context exists."
    ],
    "recurrent_regions": [
      "Return and reconstruction may recur as later evidence or improved resolution arrives.",
      "Settlement may remain OPEN or UNSETTLED and re-enter review without rewriting prior return records.",
      "A deliberate rerun creates a new attempt identity and recursively reconstructible lineage; transport retry is not rerun."
    ],
    "conditional_edges": [
      "Prepared possibility reaches crossing only after separate SourcePoint choice and separate authorization.",
      "Observation reaches evidence standing only through an independent EvidenceAssessment.",
      "Settlement reaches recognized successor standing only under the applicable admission rule.",
      "Persistence alone never creates inheritance."
    ]
  },
  "genealogy": [
    {
      "status": "EXISTING",
      "claim": "The corpus already contains typed causal graphs, formal operators and judgments, frozen experimental grammars, executable single-edge passage semantics, trace-sensitive reconstruction, return, settlement, and inheritance carriers.",
      "source_anchor_refs": [
        "src:minimum-spine",
        "src:operator-laws",
        "src:cm-core",
        "src:one-rcc",
        "src:top",
        "src:rgcb",
        "src:pbr",
        "src:chr",
        "src:one-v1-stacked"
      ]
    },
    {
      "status": "IMPLICIT",
      "claim": "The distributed carriers jointly form one temporal conformance surface from prepared possibility through conditional successor admission, although no prior artifact names the exact thirteen-burden whole.",
      "source_anchor_refs": [
        "src:prospective-readiness",
        "src:golden-crossing",
        "src:one-rcc",
        "src:top",
        "src:rgcb",
        "src:one-v1-stacked"
      ]
    },
    {
      "status": "NEW_DERIVATION",
      "claim": "The exact thirteen-burden Becoming Spine, the eight-surface BecomingView, and the pairing of no-silent-promotion with no-premature-collapse are introduced by this reconciliation.",
      "source_anchor_refs": [
        "src:becoming-spine",
        "src:operator-laws",
        "src:minimum-spine",
        "src:pbr"
      ]
    }
  ],
  "laws": [
    {
      "law_id": "CBS-L01",
      "name": "No Silent Promotion",
      "genealogy": "EXISTING",
      "statement": "No artifact acquires a higher type, standing, authority, evidence status, settlement status, or successor status without the explicit typed transition and distinct record required by its governing profile.",
      "source_anchor_refs": [
        "src:operator-laws",
        "src:minimum-spine",
        "src:one-rcc",
        "src:top"
      ]
    },
    {
      "law_id": "CBS-L02",
      "name": "No Premature Collapse",
      "genealogy": "EXISTING",
      "statement": "A profile may compose operations atomically only when each operation's input, output, authority basis, standing effect, temporal position, trace, and failure semantics remain separately recoverable.",
      "source_anchor_refs": [
        "src:operator-laws",
        "src:minimum-spine",
        "src:pbr",
        "src:chr"
      ]
    },
    {
      "law_id": "CBS-L03",
      "name": "Promotion-Collapse Conservation Pair",
      "genealogy": "NEW_DERIVATION",
      "statement": "Standing may not increase without an explicit typed transition; consequential differentiation may not decrease without action-relative adequacy.",
      "source_anchor_refs": [
        "src:becoming-spine",
        "src:operator-laws",
        "src:pbr"
      ]
    }
  ],
  "stages": [
    {
      "stage_id": "CBS-01",
      "order": 1,
      "name": "Possibility",
      "burden_kind": "FIELD_STATE",
      "binding_status": "EXISTING_DOCUMENTED_FRONT_EDGE",
      "definition": "Carry differentiated possible futures without treating any candidate as inevitable, chosen, authorized, or executable.",
      "carriers": [
        {
          "carrier_id": "ScenarioSet",
          "role": "Holds the bounded candidate population from which prospective preparation is formed.",
          "standing": "EXISTING_CANDIDATE_SEMANTICS",
          "scope": "Prospective Readiness documentation-only composition.",
          "source_anchor_refs": ["src:prospective-readiness"]
        },
        {
          "carrier_id": "PreparedPossibilityField",
          "role": "Holds sealed dormant candidates, assumptions, provenance, uncertainty, expiry, and invalidation conditions with consequence standing NONE.",
          "standing": "EXISTING_DOCUMENTED",
          "scope": "Candidate research contract; no runtime service or schema is asserted.",
          "source_anchor_refs": ["src:prepared-field"]
        },
        {
          "carrier_id": "RENEWED(P)",
          "role": "Predicates that a live possibility field was faithfully reconstituted without implying choice, authorization, or execution.",
          "standing": "EXISTING_FORMAL",
          "scope": "Frozen RGCB field predicate, not an eighth operator.",
          "source_anchor_refs": ["src:rgcb"]
        }
      ],
      "non_conversions": [
        "PreparedPossibilityField != Truth",
        "PreparedPossibilityField != Intent",
        "RENEWED(P) != Chosen",
        "Possibility != Authorization"
      ],
      "source_anchor_refs": ["src:prospective-readiness", "src:prepared-field", "src:rgcb"]
    },
    {
      "stage_id": "CBS-02",
      "order": 2,
      "name": "Preparation",
      "burden_kind": "FORMATION_AND_CUSTODY",
      "binding_status": "EXISTING_DOCUMENTED_FRONT_EDGE",
      "definition": "Form, preserve, correspond, revalidate, and orient prepared material while keeping its zero-egress and non-authoritative standing explicit.",
      "carriers": [
        {
          "carrier_id": "RehearsalRun",
          "role": "Records bounded formation or evaluation used to prepare candidate responses.",
          "standing": "EXISTING_DOCUMENTED",
          "scope": "Observation-first constitutional rehearsal candidate discipline.",
          "source_anchor_refs": ["src:rehearsal"]
        },
        {
          "carrier_id": "ProspectiveCommitment",
          "role": "Seals time, source, profile, candidate population, feature definitions, expiry, invalidation rules, and exposure lineage.",
          "standing": "EXISTING_CANDIDATE_SEMANTICS",
          "scope": "A preparation-custody seal; not SourcePoint commitment or execution commitment.",
          "source_anchor_refs": ["src:prospective-readiness", "src:prepared-field"]
        }
      ],
      "non_conversions": [
        "Preparation != Intent",
        "ProspectiveCommitment != SourcePointCommitment",
        "Rehearsal != Prediction",
        "PreparedResponse != ExecutableAction"
      ],
      "source_anchor_refs": ["src:prospective-readiness", "src:prepared-field", "src:rehearsal"]
    },
    {
      "stage_id": "CBS-03",
      "order": 3,
      "name": "Choice",
      "burden_kind": "HUMAN_DISPOSITION",
      "binding_status": "EXISTING_EXECUTABLE_BOUND",
      "definition": "Record the SourcePoint decision to author or decline an exact intent without inheriting standing from a prepared candidate or bearing.",
      "carriers": [
        {
          "carrier_id": "SourcePointAuthorshipDeclaration",
          "role": "Binds the human decision, action, target, payload, candidate, bearing, signature basis, and time.",
          "standing": "EXISTING_EXECUTABLE",
          "scope": "Experimental RGCB-Golden Crossing reference interface.",
          "source_anchor_refs": ["src:golden-crossing"]
        },
        {
          "carrier_id": "CandidateIntent",